{
  "source_id": "SRC-001",
  "title": "Fictional River Learning Collective Volunteer Page",
  "url": "https://fictional-river-learning.example.org/volunteer",
  "source_type": "official_website",
  "publisher": "Fictional River Learning Collective",
  "publication_date": null,
  "retrieved_at": "2026-08-09T09:10:00Z",
  "authority_level": "official",
  "freshness": "current",
  "is_official": true
}

